{
  "version": {
    "major": 0,
    "minor": 0
  },
  "family": "initialize",
  "requestId": "req-1",
  "kind": "query",
  "payload": {
    "versions": [
      {
        "major": 0,
        "minor": 0
      }
    ],
    "components": [
      {
        "name": "graph-service",
        "version": "0.1"
      }
    ],
    "hostId": "host-a",
    "workspaceId": "workspace-a",
    "capabilities": [
      "graph.read",
      "edit.prepare"
    ],
    "trustState": "restricted"
  },
  "extensions": {
    "future.hint": {
      "mandatory": false,
      "value": "compact"
    }
  }
}
